{
  "version": 1,
  "updatedAt": "2026-10-23T04:53:44.349Z",
  "site": {
    "pageTitle": "MAX 教育理念島｜孩子為本，一起長大",
    "description": "一座島，一個教育信念。14 個理念主題，看見課程、老師、家長與社區如何彼此相連。",
    "brandTop": "GROW",
    "brandBottom": "TOGETHER.",
    "title": "孩子為本，一起長大",
    "badge": "MAX",
    "subtitle": "教育理念島",
    "indexKicker": "THE EDUCATION INDEX",
    "headline": "讓每個孩子，都被看見。",
    "intro": "選一座島，走進它的學習風景。",
    "footer": "© MAX · 教育理念島",
    "timeSpeed": 2,
    "timeMode": "auto",
    "tutorial": [
      {
        "title": "每一座島都是一個教育信念",
        "body": "14 座六角島拼成一所學校的樣子。點一座島，或用右側清單探索每個理念的具體做法。"
      },
      {
        "title": "小人們在島與島之間搬運",
        "body": "學生、老師、家長、小農、漁民……沿著協作連結來回奔走。點路上的小人，看看他正把什麼帶去哪裡。"
      },
      {
        "title": "四季會自己輪替",
        "body": "網站依照日期每三個月換一季；也可以用左上角的季節按鈕，手動切換春、夏、秋、冬。"
      },
      {
        "title": "一天也會自己流動",
        "body": "清晨、白天、黃昏、夜晚的光線會跟著島上的時鐘變化；想停在某個時刻，就手動鎖定或按暫停。"
      }
    ],
    "adminRepo": {
      "owner": "maxchin18",
      "repo": "max-edu-island",
      "branch": "main",
      "path": "data/site.json"
    }
  },
  "values": [
    {
      "id": "M",
      "name": "有感學習",
      "en": "Meaningful",
      "color": "#5DBB7A",
      "desc": "學習連結生活，孩子知道為什麼而學。"
    },
    {
      "id": "A",
      "name": "動手實踐",
      "en": "Action",
      "color": "#F29A5B",
      "desc": "做中學、真實任務，把知識變成能力。"
    },
    {
      "id": "X",
      "name": "跨域探索",
      "en": "eXplore",
      "color": "#5B9BEF",
      "desc": "跨領域、跨世代、跨國界，打開孩子的視野。"
    }
  ],
  "linkBasis": [
    "校本理念",
    "課程實踐",
    "社群共備",
    "社區協作"
  ],
  "phases": [
    "短期",
    "中期",
    "長期",
    "持續推動",
    "每學期",
    "每學年"
  ],
  "islands": [
    {
      "id": "core",
      "name": "孩子為本",
      "icon": "🧒",
      "color": "#F07C5A",
      "landmark": "school",
      "q": 0,
      "r": 0,
      "tagline": "每一個決定，都先問：這對孩子好嗎？",
      "quote": "學校不是為了大人的方便而存在，而是為了孩子的成長而存在。",
      "values": [
        "M",
        "A"
      ],
      "source": {
        "label": "",
        "url": ""
      },
      "items": [
        {
          "id": "core-1",
          "name": "學生學習地圖",
          "phase": "持續推動",
          "target": "全校學生",
          "summary": "盤點一到六年級的學習歷程，讓孩子、老師與家長都看得見「學到哪裡、接下來去哪裡」。",
          "points": [
            "六年學習歷程一張圖",
            "校訂課程與部定課程對應",
            "每學期回顧與調整"
          ],
          "schedule": "每學期期末更新",
          "image": "",
          "link": ""
        },
        {
          "id": "core-2",
          "name": "差異化教學",
          "phase": "中期",
          "target": "各班教師",
          "summary": "同一堂課、不同起點：用分組、分層任務與多元評量，照顧每個孩子的學習差異。",
          "points": [
            "分層學習任務",
            "多元評量取代單一考卷",
            "學習扶助即時銜接"
          ],
          "schedule": "逐年擴大至全校",
          "image": "",
          "link": ""
        },
        {
          "id": "core-3",
          "name": "學生自治與提案",
          "phase": "短期",
          "target": "中高年級學生",
          "summary": "成立兒童自治會，讓孩子提出改善校園的提案，在真實事務中學習民主、溝通與負責。",
          "points": [
            "每學期學生提案日",
            "提案可獲經費實作",
            "自治幹部與師長座談"
          ],
          "schedule": "本學年啟動",
          "image": "",
          "link": ""
        },
        {
          "id": "core-4",
          "name": "心理安全的校園",
          "phase": "持續推動",
          "target": "全校師生",
          "summary": "友善、零霸凌、敢犯錯——孩子在安心的環境裡，才敢舉手、才敢嘗試。",
          "points": [
            "友善校園公約",
            "霸凌即時通報與修復",
            "犯錯也是學習的一部分"
          ],
          "schedule": "",
          "image": "",
          "link": ""
        }
      ]
    },
    {
      "id": "food",
      "name": "食農教育",
      "icon": "🥬",
      "color": "#76C267",
      "landmark": "farm",
      "q": 1,
      "r": 0,
      "tagline": "從產地到餐桌，吃得懂、吃得安心、吃得感恩。",
      "quote": "當孩子親手種下一棵菜，他就再也不會隨便浪費一口飯。",
      "values": [
        "M",
        "A"
      ],
      "source": {
        "label": "",
        "url": ""
      },
      "items": [
        {
          "id": "food-1",
          "name": "校園小田園",
          "phase": "持續推動",
          "target": "全校班級",
          "summary": "每班認養一畦菜圃，從整地、播種、照顧到收成，把自然、數學與生活課都搬到田裡。",
          "points": [
            "每班一畦田",
            "觀察日誌與成長紀錄",
            "收成日與家長共享"
          ],
          "schedule": "每學期一輪作",
          "image": "",
          "link": ""
        },
        {
          "id": "food-2",
          "name": "「敲敲蛤蜊」食農課程",
          "phase": "每學年",
          "target": "五年級",
          "summary": "以在地文蛤養殖為主題，結合繪本、漫畫、學習單與教學簡報，帶孩子認識蛤蜊從魚塭到餐桌的旅程。",
          "points": [
            "自編繪本與漫畫",
            "學習單與教學簡報",
            "結合在地養殖戶"
          ],
          "schedule": "五年級校訂課程",
          "image": "",
          "link": "https://github.com/maxchin18/knock-knock-clam"
        },
        {
          "id": "food-3",
          "name": "在地食材營養午餐",
          "phase": "中期",
          "target": "全校師生",
          "summary": "午餐優先採用在地、當季食材，並附上「食材故事卡」，讓每一口都吃得懂來源。",
          "points": [
            "在地當季食材",
            "食材故事卡",
            "減少剩食"
          ],
          "schedule": "",
          "image": "",
          "link": ""
        },
        {
          "id": "food-4",
          "name": "食農教案共備",
          "phase": "短期",
          "target": "校內教師",
          "summary": "依臺南市食農教育優良教案格式，跨領域共備教案，整理圖文並茂的教學資源。",
          "points": [
            "跨領域共備",
            "教案規格化與分享",
            "參加教案甄選"
          ],
          "schedule": "每學期一次共備週",
          "image": "",
          "link": ""
        }
      ]
    },
    {
      "id": "ocean",
      "name": "海洋教育",
      "icon": "🐟",
      "color": "#4BB3D9",
      "landmark": "harbor",
      "q": 1,
      "r": -1,
      "tagline": "台江的孩子，認識自己的海。",
      "quote": "海不是課本上的一張圖，是孩子家門外的風景，也是家人的生計。",
      "values": [
        "M",
        "X"
      ],
      "source": {
        "label": "",
        "url": ""
      },
      "items": [
        {
          "id": "ocean-1",
          "name": "超級魚戰士—台灣鯛",
          "phase": "每學年",
          "target": "中高年級",
          "summary": "從台灣鯛的養殖、營養到料理，搭配教案、自編繪本、繪本動畫、學習單與魚鬆三折頁，認識在地重要漁產。",
          "points": [
            "自編繪本與動畫",
            "魚鬆三折頁實作",
            "Padlet 議題交流"
          ],
          "schedule": "",
          "image": "",
          "link": "https://github.com/maxchin18/super-fish-warrior"
        },
        {
          "id": "ocean-2",
          "name": "三魚海味探索",
          "phase": "中期",
          "target": "高年級",
          "summary": "以東港、蚵仔寮、大潭三個漁港為題，用海洋食農繪本與配音動畫，比較不同漁港的漁業文化。",
          "points": [
            "三個漁港比較",
            "學生配音動畫",
            "海洋職人訪談"
          ],
          "schedule": "",
          "image": "",
          "link": "https://github.com/maxchin18/sanyu-picture-book"
        },
        {
          "id": "ocean-3",
          "name": "水域安全與自救",
          "phase": "持續推動",
          "target": "全校學生",
          "summary": "游泳與自救是海邊孩子的基本功，目標讓每位畢業生都具備水域自救能力。",
          "points": [
            "游泳課程",
            "水域安全宣導",
            "畢業生自救能力檢核"
          ],
          "schedule": "",
          "image": "",
          "link": ""
        },
        {
          "id": "ocean-4",
          "name": "台江濕地踏查",
          "phase": "每學期",
          "target": "中年級",
          "summary": "走進台江國家公園與四草濕地，觀察紅樹林、招潮蟹與候鳥，學會欣賞也學會守護。",
          "points": [
            "紅樹林生態觀察",
            "候鳥季賞鳥",
            "淨灘行動"
          ],
          "schedule": "",
          "image": "",
          "link": ""
        }
      ]
    },
    {
      "id": "read",
      "name": "閱讀素養",
      "icon": "📚",
      "color": "#A787D9",
      "landmark": "library",
      "q": 0,
      "r": -1,
      "tagline": "讀得懂世界，也說得出自己。",
      "quote": "閱讀不是為了考試，而是讓孩子擁有一輩子帶得走的好奇心。",
      "values": [
        "M",
        "X"
      ],
      "source": {
        "label": "",
        "url": ""
      },
      "items": [
        {
          "id": "read-1",
          "name": "晨讀十分鐘",
          "phase": "持續推動",
          "target": "全校學生",
          "summary": "每天早上十分鐘安靜閱讀，老師也一起讀，讓閱讀成為生活習慣。",
          "points": [
            "師生共讀",
            "自選書目",
            "不考試、不寫心得的純閱讀"
          ],
          "schedule": "",
          "image": "",
          "link": ""
        },
        {
          "id": "read-2",
          "name": "自編繪本創作",
          "phase": "中期",
          "target": "中高年級",
          "summary": "把在地故事、食農與海洋經驗寫成繪本，再配音做成動畫，讓孩子從讀者變成作者。",
          "points": [
            "故事構思與分鏡",
            "繪本排版",
            "配音與動畫"
          ],
          "schedule": "",
          "image": "",
          "link": ""
        },
        {
          "id": "read-3",
          "name": "閱讀護照",
          "phase": "短期",
          "target": "低中年級",
          "summary": "用閱讀護照記錄閱讀足跡，搭配班級共讀與好書分享。",
          "points": [
            "分級閱讀推薦",
            "班級共讀",
            "好書分享會"
          ],
          "schedule": "",
          "image": "",
          "link": ""
        },
        {
          "id": "read-4",
          "name": "圖書館學習中心",
          "phase": "長期",
          "target": "全校師生",
          "summary": "把圖書館打造成可以討論、查資料、做專題的學習中心。",
          "points": [
            "彈性學習空間",
            "主題書展",
            "資訊檢索教學"
          ],
          "schedule": "",
          "image": "",
          "link": ""
        }
      ]
    },
    {
      "id": "ai",
      "name": "AI 與數位學習",
      "icon": "🤖",
      "color": "#5B8DEF",
      "landmark": "tech",
      "q": -1,
      "r": 0,
      "tagline": "讓科技成為孩子的翅膀，不是枷鎖。",
      "quote": "會用 AI 不稀奇；會問好問題、會判斷真假，才是未來的能力。",
      "values": [
        "A",
        "X"
      ],
      "source": {
        "label": "",
        "url": ""
      },
      "items": [
        {
          "id": "ai-1",
          "name": "AI 素養課程",
          "phase": "中期",
          "target": "高年級",
          "summary": "認識生成式 AI 能做什麼、不能做什麼，練習提問、查證與負責任地使用。",
          "points": [
            "提問與提示設計",
            "查證與判讀",
            "AI 倫理與隱私"
          ],
          "schedule": "",
          "image": "",
          "link": ""
        },
        {
          "id": "ai-2",
          "name": "有意義的平板學習",